<assembly xmlns="http://jasperblues.github.com/Typhoon/schema/assembly"
          xmlns:xsi="http://www.w3.org/2001/XMLSchema-instance"
          xsi:schemaLocation="http://jasperblues.github.com/Typhoon/schema/assembly
          http://www.appsquick.ly/schema/assembly.xsd">


    <component class="NSURL" key="anotherServiceUrl">
        <initializer selector="URLWithString:">
            <argument parameterName="string" value="http://dev.foobar.com/service/">
                <description>
                    This will fail because the required-class attribute is not set.
                </description>
            </argument>
        </initializer>
    </component>

    <component class="NSString" key="aBlaString">
        <initializer selector="stringWithBlingBlaBla">
            <argument parameterName="specification" value="blue"/>
        </initializer>
    </component>


</assembly>